<aligoFlow name="flow_demo" version="1"
  xmlns="http://www.aligo.com/schema/ares/flow"
  xmlns:xsi="http://www.w3.org/2001/XMLSchema-instance"
  xsi:schemaLocation="http://www.aligo.com/schema/ares/flow/aligoFlow.xsd">


    <flow name="adjust" identifier="LEASEEV_BIKE:outbound:*">
        <step name="PARAM_VALID" priority="0" check="true">
            <stream priority="1">
                <node executableComponent="IdempotentValidator"/>
                <node executableComponent="WarehouseInfoValidator"/>
            </stream>
        </step>


        <!--核心领域能力，变更数据库，整体事务-->
        <step name="BIZ_PROCESSOR" priority="3" transaction="true" >
            <stream priority="1">
                <node executableComponent="AdjustInventoryProcessor"/>
                <node executableComponent="ChangeAssetStatusProcessor"/>
            </stream>
        </step>

        <step name="AFTER_BIZ_PROCESSOR" priority="4">
            <stream priority="1">
                <node executableComponent="StockChangeMessageProcessor"/>
            </stream>
        </step>
    </flow>

</aligoFlow>
